{
  "$schema": "../../../../../public/schemas/level.schema.json",
  "id": "koje_42",
  "name": "Bunker Koje 42 Arenberg",
  "version": "1.0.0",
  "description": "7x7m Wohnkoje von Großvater František Novotny im Flakturm Arenberg.",
  "props": [
    {
      "id": "MetalDesk",
      "kitProp": "bunker/metal_desk",
      "position": [-0.6, 0, -1.0],
      "scale": 0.75,
      "materialOverrides": {
        "roughness": 0.75,
        "metallic": 0.45
      }
    },
    {
      "id": "MetalStool",
      "kitProp": "bunker/metal_stool",
      "position": [-0.6, 0, -0.4],
      "rotation": [0, 0.25, 0],
      "scale": 0.5,
      "materialOverrides": {
        "roughness": 0.7,
        "metallic": 0.55
      }
    },
    {
      "id": "KeroseneLantern",
      "kitProp": "bunker/kerosene_lantern",
      "position": [-0.9, 0.78, -1.0],
      "scale": 0.35,
      "lightOverrides": {
        "FlameGlow": {
          "color": "#d49a3d",
          "intensity": 2.5,
          "distance": 6.0
        }
      },
      "materialOverrides": {
        "roughness": 0.38,
        "metallic": 0.8
      }
    },
    {
      "id": "CoffeeGrinder",
      "kitProp": "bunker/coffee_grinder",
      "position": [-0.35, 0.78, -1.0],
      "scale": 0.35,
      "materialOverrides": {
        "roughness": 0.82,
        "metallic": 0.25
      }
    },
    {
      "id": "MessTinSet",
      "kitProp": "bunker/mess_tin_set",
      "position": [-0.6, 0.78, -0.92],
      "scale": 0.3,
      "materialOverrides": {
        "roughness": 0.55,
        "metallic": 0.65
      }
    },
    {
      "id": "WallShelfSupplies",
      "kitProp": "bunker/wall_shelf_supplies",
      "position": [-0.6, 1.45, -1.38],
      "scale": 0.45,
      "materialOverrides": {
        "roughness": 0.88,
        "metallic": 0.1
      }
    },
    {
      "id": "HangingTowels",
      "kitProp": "bunker/hanging_towels",
      "position": [-1.6, 1.5, -1.38],
      "scale": 0.4,
      "materialOverrides": {
        "roughness": 0.95,
        "metallic": 0.05
      }
    },
    {
      "id": "BunkBed",
      "kitProp": "bunker/bunk_bed",
      "position": [1.5, 0, -0.6],
      "scale": 1.15,
      "materialOverrides": {
        "roughness": 0.85,
        "metallic": 0.35
      }
    },
    {
      "id": "CombatBoots",
      "kitProp": "bunker/combat_boots",
      "position": [0.85, 0, -0.6],
      "rotation": [0, 0.35, 0],
      "scale": 0.35,
      "materialOverrides": {
        "roughness": 0.85,
        "metallic": 0.1
      }
    },
    {
      "id": "WornRug",
      "kitProp": "bunker/worn_rug",
      "position": [0, 0.01, 0],
      "scale": 1.0,
      "materialOverrides": {
        "roughness": 0.95,
        "metallic": 0.0
      }
    },
    {
      "id": "CeilingLamp",
      "kitProp": "flakturm/ceiling_lamp",
      "position": [0, 3.08, 0],
      "scale": 0.35,
      "lightOverrides": {
        "BulbLight": {
          "color": "#dbe8f5",
          "intensity": 2.0,
          "distance": 7.5
        }
      },
      "materialOverrides": {
        "roughness": 0.45,
        "metallic": 0.8
      }
    },
    {
      "id": "VentWallBreach",
      "kitProp": "flakturm/vent_wall_breach",
      "position": [2.38, 0.35, 0.8],
      "rotation": [0, -1.570796, 0],
      "scale": 0.6,
      "materialOverrides": {
        "roughness": 0.7,
        "metallic": 0.55
      }
    }
  ],
  "lights": [
    {
      "name": "DoorHallwayBeam",
      "type": "spot",
      "color": "#ffd273",
      "intensity": 18.0,
      "distance": 14.0,
      "position": [-2.6, 2.2, -0.6],
      "target": [0.5, 0.8, 0.5],
      "angle": 0.698132,
      "penumbra": 0.6,
      "decay": 1.1
    }
  ],
  "hotspots": [
    {
      "id": "grinder",
      "name": "Františeks Kaffeemühle",
      "position": [-0.35, 0, -0.8],
      "interactionRadius": 1.2,
      "promptText": "Kaffeemühle untersuchen",
      "monologueTitle": "Františeks Kaffeemühle",
      "monologueText": [
        "Aus massivem Nussbaumholz und Messing. Großvater František hat sie vor 50 Jahren aus der alten Welt gerettet.",
        "Er hat mir beigebracht, getrocknete Gerste und geröstete Eicheln zu mahlen... 'Ein Wiener ohne seinen Kaffee ist kein Mensch, Novotny.'",
        "Im doppelten Mahlwerk-Boden: Eine Packung trockene Zündhölzer. Ich stecke sie ein."
      ]
    },
    {
      "id": "desk_supplies",
      "name": "Schreibtisch & Vorräte",
      "position": [-0.7, 0, -0.6],
      "interactionRadius": 1.3,
      "promptText": "Arbeitsplatz & Vorräte durchsuchen",
      "monologueTitle": "Františeks Arbeitsplatz",
      "monologueText": [
        "Ein abgewetzter Stahltisch mit Emaillegeschirr, gefalteten Wollpullovern und der Messing-Petroleumlampe.",
        "Auf einem Zettel unter der Lampe stehen Notizen über ungewöhnliche Stromschwankungen in Sektor 0.",
        "František wusste, dass in der Kältekammer etwas nicht stimmte."
      ]
    },
    {
      "id": "bed",
      "name": "Stockbett & Stiefel",
      "position": [1.2, 0, -0.6],
      "interactionRadius": 1.4,
      "promptText": "Františeks Lager & Stiefel untersuchen",
      "monologueTitle": "Das leere Lager",
      "monologueText": [
        "Die raue Wolldecke ist noch zerknittert. Gestern Abend saß er hier und summte ein altes Lied über den Wienerwald.",
        "Seine schweren Lederstiefel stehen noch unterm Bett. Er hat sie extra stehen lassen, um im Schacht keine lauten Schritte zu machen."
      ]
    },
    {
      "id": "terminal",
      "name": "Amts-Terminal 2100",
      "position": [0, 0, 0.8],
      "interactionRadius": 1.3,
      "promptText": "Amts-Terminal 2100 öffnen",
      "monologueTitle": "Amtsrat 4.1 Feldcomputer",
      "monologueText": [
        "Das gepanzerte Amts-Terminal, das Hawelka mir zugeworfen hat. Der Bildschirm flackert bernsteinfarben.",
        "Akte GZ 2100-AZS/STERBEFALL-0815 ist versiegelt. Todesursache offiziell: Herz-Kreislauf-Versagen... Angeordnet von Hofrat Brandstätter."
      ],
      "action": "open_terminal"
    },
    {
      "id": "door",
      "name": "Gepanzerte Panzertür",
      "position": [-2.2, 0, 0.5],
      "interactionRadius": 1.3,
      "promptText": "Schleusentür prüfen",
      "monologueTitle": "Verriegelter Flur",
      "monologueText": [
        "Schwere Stahlriegel halten die Tür von außen zu. Hawelka hat sie nach dem Alarm zugeworfen.",
        "Auf dem Gang patrouillieren Pollaks Schleusenwachen. Ein Ausbruch durch die Haupttür wäre Selbstmord."
      ]
    },
    {
      "id": "vent",
      "name": "Lüftungsschacht / Fluchtweg",
      "position": [2.0, 0, 0.8],
      "interactionRadius": 1.3,
      "promptText": "Lüftungsgitter öffnen & in Schacht klettern",
      "monologueTitle": "Der geheime Fluchtweg",
      "monologueText": [
        "An der Ostwand, dicht über dem feuchten Boden: Das schwere Eisengitter ist bereits aufgeschraubt.",
        "Dahinter pfeift eisige Ammoniakluft herauf: Der Schacht führt direkt in die Kältekammer K-42..."
      ],
      "action": "transition_kaeltekammer"
    }
  ]
}
